Development of deep learning algorithms to categorize free-text notes   pertaining to diabetes: convolution neural networks achieve higher accuracy   than support vector machines	Health professionals can use natural language processing (NLP) technologies when reviewing electronic health records (EHR). Machine learning free-text classifiers can help them identify problems and make critical decisions. We aim to develop deep learning neural network algorithms that identify EHR progress notes pertaining to diabetes and validate the algorithms at two institutions. The data used are 2,000 EHR progress notes retrieved from patients with diabetes and all notes were annotated manually as diabetic or non-diabetic. Several deep learning classifiers were developed, and their performances were evaluated with the area under the ROC curve (AUC). The convolutional neural network (CNN) model with a separable convolution layer accurately identified diabetes-related notes in the Brigham and Womens Hospital testing set with the highest AUC of 0.975. Deep learning classifiers can be used to identify EHR progress notes pertaining to diabetes. In particular, the CNN-based classifier can achieve a higher AUC than an SVM-based classifier.
Relational Neural Machines	Deep learning has been shown to achieve impressive results in several tasks where a large amount of training data is available. However, deep learning solely focuses on the accuracy of the predictions, neglecting the reasoning process leading to a decision, which is a major issue in life-critical applications. Probabilistic logic reasoning allows to exploit both statistical regularities and specific domain expertise to perform reasoning under uncertainty, but its scalability and brittle integration with the layers processing the sensory data have greatly limited its applications. For these reasons, combining deep architectures and probabilistic logic reasoning is a fundamental goal towards the development of intelligent agents operating in complex environments. This paper presents Relational Neural Machines, a novel framework allowing to jointly train the parameters of the learners and of a First--Order Logic based reasoner. A Relational Neural Machine is able to recover both classical learning from supervised data in case of pure sub-symbolic learning, and Markov Logic Networks in case of pure symbolic reasoning, while allowing to jointly train and perform inference in hybrid learning tasks. Proper algorithmic solutions are devised to make learning and inference tractable in large-scale problems. The experiments show promising results in different relational tasks.
From Boltzmann Machines to Neural Networks and Back Again	Graphical models are powerful tools for modeling high-dimensional data, but learning graphical models in the presence of latent variables is well-known to be difficult. In this work we give new results for learning Restricted Boltzmann Machines, probably the most well-studied class of latent variable models. Our results are based on new connections to learning two-layer neural networks under $\ell_{\infty}$ bounded input; for both problems, we give nearly optimal results under the conjectured hardness of sparse parity with noise. Using the connection between RBMs and feedforward networks, we also initiate the theoretical study of $supervised~RBMs$ [Hinton, 2012], a version of neural-network learning that couples distributional assumptions induced from the underlying graphical model with the architecture of the unknown function class. We then give an algorithm for learning a natural class of supervised RBMs with better runtime than what is possible for its related class of networks without distributional assumptions.
Graph Neural Networks for Small Graph and Giant Network Representation   Learning: An Overview	Graph neural networks denote a group of neural network models introduced for the representation learning tasks on graph data specifically. Graph neural networks have been demonstrated to be effective for capturing network structure information, and the learned representations can achieve the state-of-the-art performance on node and graph classification tasks. Besides the different application scenarios, the architectures of graph neural network models also depend on the studied graph types a lot. Graph data studied in research can be generally categorized into two main types, i.e., small graphs vs. giant networks, which differ from each other a lot in the size, instance number and label annotation. Several different types of graph neural network models have been introduced for learning the representations from such different types of graphs already. In this paper, for these two different types of graph data, we will introduce the graph neural networks introduced in recent years. To be more specific, the graph neural networks introduced in this paper include IsoNN, SDBN, LF&ER, GCN, GAT, DifNN, GNL, GraphSage and seGEN. Among these graph neural network models, IsoNN, SDBN and LF&ER are initially proposed for small graphs and the remaining ones are initially proposed for giant networks instead. The readers are also suggested to refer to these papers for detailed information when reading this tutorial paper.
DropNeuron: Simplifying the Structure of Deep Neural Networks	Deep learning using multi-layer neural networks (NNs) architecture manifests superb power in modern machine learning systems. The trained Deep Neural Networks (DNNs) are typically large. The question we would like to address is whether it is possible to simplify the NN during training process to achieve a reasonable performance within an acceptable computational time. We presented a novel approach of optimising a deep neural network through regularisation of net- work architecture. We proposed regularisers which support a simple mechanism of dropping neurons during a network training process. The method supports the construction of a simpler deep neural networks with compatible performance with its simplified version. As a proof of concept, we evaluate the proposed method with examples including sparse linear regression, deep autoencoder and convolutional neural network. The valuations demonstrate excellent performance.   The code for this work can be found in http://www.github.com/panweihit/DropNeuron
Neural-Kernelized Conditional Density Estimation	Conditional density estimation is a general framework for solving various problems in machine learning. Among existing methods, non-parametric and/or kernel-based methods are often difficult to use on large datasets, while methods based on neural networks usually make restrictive parametric assumptions on the probability densities. Here, we propose a novel method for estimating the conditional density based on score matching. In contrast to existing methods, we employ scalable neural networks, but do not make explicit parametric assumptions on densities. The key challenge in applying score matching to neural networks is computation of the first- and second-order derivatives of a model for the log-density. We tackle this challenge by developing a new neural-kernelized approach, which can be applied on large datasets with stochastic gradient descent, while the reproducing kernels allow for easy computation of the derivatives needed in score matching. We show that the neural-kernelized function approximator has universal approximation capability and that our method is consistent in conditional density estimation. We numerically demonstrate that our method is useful in high-dimensional conditional density estimation, and compares favourably with existing methods. Finally, we prove that the proposed method has interesting connections to two probabilistically principled frameworks of representation learning: Nonlinear sufficient dimension reduction and nonlinear independent component analysis.
Learning Numeracy: Binary Arithmetic with Neural Turing Machines	One of the main problems encountered so far with recurrent neural networks is that they struggle to retain long-time information dependencies in their recurrent connections. Neural Turing Machines (NTMs) attempt to mitigate this issue by providing the neural network with an external portion of memory, in which information can be stored and manipulated later on. The whole mechanism is differentiable end-to-end, allowing the network to learn how to utilise this long-term memory via stochastic gradient descent. This allows NTMs to infer simple algorithms directly from data sequences. Nonetheless, the model can be hard to train due to a large number of parameters and interacting components and little related work is present. In this work we use NTMs to learn and generalise two arithmetical tasks: binary addition and multiplication. These tasks are two fundamental algorithmic examples in computer science, and are a lot more challenging than the previously explored ones, with which we aim to shed some light on the real capabilities on this neural model.
Machine Learning Topological Invariants with Neural Networks	In this Letter we supervisedly train neural networks to distinguish different topological phases in the context of topological band insulators. After training with Hamiltonians of one-dimensional insulators with chiral symmetry, the neural network can predict their topological winding numbers with nearly 100% accuracy, even for Hamiltonians with larger winding numbers that are not included in the training data. These results show a remarkable success that the neural network can capture the global and nonlinear topological features of quantum phases from local inputs. By opening up the neural network, we confirm that the network does learn the discrete version of the winding number formula. We also make a couple of remarks regarding the role of the symmetry and the opposite effect of regularization techniques when applying machine learning to physical systems.
Finding trainable sparse networks through Neural Tangent Transfer	Deep neural networks have dramatically transformed machine learning, but their memory and energy demands are substantial. The requirements of real biological neural networks are rather modest in comparison, and one feature that might underlie this austerity is their sparse connectivity. In deep learning, trainable sparse networks that perform well on a specific task are usually constructed using label-dependent pruning criteria. In this article, we introduce Neural Tangent Transfer, a method that instead finds trainable sparse networks in a label-free manner. Specifically, we find sparse networks whose training dynamics, as characterized by the neural tangent kernel, mimic those of dense networks in function space. Finally, we evaluate our label-agnostic approach on several standard classification tasks and show that the resulting sparse networks achieve higher classification performance while converging faster.
A Survey: Time Travel in Deep Learning Space: An Introduction to Deep   Learning Models and How Deep Learning Models Evolved from the Initial Ideas	This report will show the history of deep learning evolves. It will trace back as far as the initial belief of connectionism modelling of brain, and come back to look at its early stage realization: neural networks. With the background of neural network, we will gradually introduce how convolutional neural network, as a representative of deep discriminative models, is developed from neural networks, together with many practical techniques that can help in optimization of neural networks. On the other hand, we will also trace back to see the evolution history of deep generative models, to see how researchers balance the representation power and computation complexity to reach Restricted Boltzmann Machine and eventually reach Deep Belief Nets. Further, we will also look into the development history of modelling time series data with neural networks. We start with Time Delay Neural Networks and move further to currently famous model named Recurrent Neural Network and its extension Long Short Term Memory. We will also briefly look into how to construct deep recurrent neural networks. Finally, we will conclude this report with some interesting open-ended questions of deep neural networks.
Quantifying the generalization error in deep learning in terms of data   distribution and neural network smoothness	The accuracy of deep learning, i.e., deep neural networks, can be characterized by dividing the total error into three main types: approximation error, optimization error, and generalization error. Whereas there are some satisfactory answers to the problems of approximation and optimization, much less is known about the theory of generalization. Most existing theoretical works for generalization fail to explain the performance of neural networks in practice. To derive a meaningful bound, we study the generalization error of neural networks for classification problems in terms of data distribution and neural network smoothness. We introduce the cover complexity (CC) to measure the difficulty of learning a data set and the inverse of the modulus of continuity to quantify neural network smoothness. A quantitative bound for expected accuracy/error is derived by considering both the CC and neural network smoothness. Although most of the analysis is general and not specific to neural networks, we validate our theoretical assumptions and results numerically for neural networks by several data sets of images. The numerical results confirm that the expected error of trained networks scaled with the square root of the number of classes has a linear relationship with respect to the CC. We also observe a clear consistency between test loss and neural network smoothness during the training process. In addition, we demonstrate empirically that the neural network smoothness decreases when the network size increases whereas the smoothness is insensitive to training dataset size.
Machine-learning-based methods for output only structural modal   identification	In this study, we propose a machine-learning-based approach to identify the modal parameters of the output-only data for structural health monitoring (SHM) that makes full use of the characteristic of independence of modal responses and the principle of machine learning. By taking advantage of the independence feature of each mode, we use the principle of unsupervised learning, making the training process of the deep neural network becomes the process of modal separation. A self-coding deep neural network is designed to identify the structural modal parameters from the vibration data of structures. The mixture signals, that is, the structural response data, are used as the input of the neural network. Then we use a complex loss function to restrict the training process of the neural network, making the output of the third layer the modal responses we want, and the weights of the last two layers are mode shapes. The deep neural network is essentially a nonlinear objective function optimization problem. A novel loss function is proposed to constrain the independent feature with consideration of uncorrelation and non-Gaussianity to restrict the designed neural network to obtain the structural modal parameters. A numerical example of a simple structure and an example of actual SHM data from a cable-stayed bridge are presented to illustrate the modal parameter identification ability of the proposed approach. The results show the approach's good capability in blindly extracting modal information from system responses.
Meta-Learning Representations for Continual Learning	A continual learning agent should be able to build on top of existing knowledge to learn on new data quickly while minimizing forgetting. Current intelligent systems based on neural network function approximators arguably do the opposite---they are highly prone to forgetting and rarely trained to facilitate future learning. One reason for this poor behavior is that they learn from a representation that is not explicitly trained for these two goals. In this paper, we propose OML, an objective that directly minimizes catastrophic interference by learning representations that accelerate future learning and are robust to forgetting under online updates in continual learning. We show that it is possible to learn naturally sparse representations that are more effective for online updating. Moreover, our algorithm is complementary to existing continual learning strategies, such as MER and GEM. Finally, we demonstrate that a basic online updating strategy on representations learned by OML is competitive with rehearsal based methods for continual learning. We release an implementation of our method at https://github.com/khurramjaved96/mrcl .
All Local Minima are Global for Two-Layer ReLU Neural Networks: The   Hidden Convex Optimization Landscape	We are interested in two-layer ReLU neural networks from an optimization perspective. We prove that the path-connected sublevel set, i.e., valleys, of a neural network which is Clarke stationary with respect to the training loss with weight decay regularization contains a specific, simpler and more structured neural network, which we call its minimal representation. We provide an explicit construction of a continuous path between the neural network and its minimal counterpart. Importantly, we show that characterizing the optimality properties of a neural network can be reduced to characterizing those of its minimal representation. Thanks to the specific structure of minimal neural networks, we show that we can embed them into a convex optimization landscape. Leveraging convexity, we are able to (i) characterize the minimal size of the hidden layer so that the neural network optimization landscape has no spurious valleys and (ii) provide a polynomial-time algorithm for checking if a neural network is a global minimum of the training loss. Overall, we provide a rich framework for studying the landscape of the neural network training loss through our embedding to a convex optimization landscape.
Neural Symbolic Machines: Learning Semantic Parsers on Freebase with   Weak Supervision (Short Version)	"Extending the success of deep neural networks to natural language understanding and symbolic reasoning requires complex operations and external memory. Recent neural program induction approaches have attempted to address this problem, but are typically limited to differentiable memory, and consequently cannot scale beyond small synthetic tasks. In this work, we propose the Manager-Programmer-Computer framework, which integrates neural networks with non-differentiable memory to support abstract, scalable and precise operations through a friendly neural computer interface. Specifically, we introduce a Neural Symbolic Machine, which contains a sequence-to-sequence neural ""programmer"", and a non-differentiable ""computer"" that is a Lisp interpreter with code assist. To successfully apply REINFORCE for training, we augment it with approximate gold programs found by an iterative maximum likelihood training process. NSM is able to learn a semantic parser from weak supervision over a large knowledge base. It achieves new state-of-the-art performance on WebQuestionsSP, a challenging semantic parsing dataset, with weak supervision. Compared to previous approaches, NSM is end-to-end, therefore does not rely on feature engineering or domain specific knowledge."
Masked Conditional Neural Networks for Automatic Sound Events   Recognition	Deep neural network architectures designed for application domains other than sound, especially image recognition, may not optimally harness the time-frequency representation when adapted to the sound recognition problem. In this work, we explore the ConditionaL Neural Network (CLNN) and the Masked ConditionaL Neural Network (MCLNN) for multi-dimensional temporal signal recognition. The CLNN considers the inter-frame relationship, and the MCLNN enforces a systematic sparseness over the network's links to enable learning in frequency bands rather than bins allowing the network to be frequency shift invariant mimicking a filterbank. The mask also allows considering several combinations of features concurrently, which is usually handcrafted through exhaustive manual search. We applied the MCLNN to the environmental sound recognition problem using the ESC-10 and ESC-50 datasets. MCLNN achieved competitive performance, using 12% of the parameters and without augmentation, compared to state-of-the-art Convolutional Neural Networks.
Music Genre Classification using Masked Conditional Neural Networks	The ConditionaL Neural Networks (CLNN) and the Masked ConditionaL Neural Networks (MCLNN) exploit the nature of multi-dimensional temporal signals. The CLNN captures the conditional temporal influence between the frames in a window and the mask in the MCLNN enforces a systematic sparseness that follows a filterbank-like pattern over the network links. The mask induces the network to learn about time-frequency representations in bands, allowing the network to sustain frequency shifts. Additionally, the mask in the MCLNN automates the exploration of a range of feature combinations, usually done through an exhaustive manual search. We have evaluated the MCLNN performance using the Ballroom and Homburg datasets of music genres. MCLNN has achieved accuracies that are competitive to state-of-the-art handcrafted attempts in addition to models based on Convolutional Neural Networks.
Composite Neural Network: Theory and Application to PM2.5 Prediction	This work investigates the framework and performance issues of the composite neural network, which is composed of a collection of pre-trained and non-instantiated neural network models connected as a rooted directed acyclic graph for solving complicated applications. A pre-trained neural network model is generally well trained, targeted to approximate a specific function. Despite a general belief that a composite neural network may perform better than a single component, the overall performance characteristics are not clear. In this work, we construct the framework of a composite network, and prove that a composite neural network performs better than any of its pre-trained components with a high probability bound. In addition, if an extra pre-trained component is added to a composite network, with high probability, the overall performance will not be degraded. In the study, we explore a complicated application---PM2.5 prediction---to illustrate the correctness of the proposed composite network theory. In the empirical evaluations of PM2.5 prediction, the constructed composite neural network models support the proposed theory and perform better than other machine learning models, demonstrate the advantages of the proposed framework.
Porcupine Neural Networks: (Almost) All Local Optima are Global	Neural networks have been used prominently in several machine learning and statistics applications. In general, the underlying optimization of neural networks is non-convex which makes their performance analysis challenging. In this paper, we take a novel approach to this problem by asking whether one can constrain neural network weights to make its optimization landscape have good theoretical properties while at the same time, be a good approximation for the unconstrained one. For two-layer neural networks, we provide affirmative answers to these questions by introducing Porcupine Neural Networks (PNNs) whose weight vectors are constrained to lie over a finite set of lines. We show that most local optima of PNN optimizations are global while we have a characterization of regions where bad local optimizers may exist. Moreover, our theoretical and empirical results suggest that an unconstrained neural network can be approximated using a polynomially-large PNN.
TensorFuzz: Debugging Neural Networks with Coverage-Guided Fuzzing	Machine learning models are notoriously difficult to interpret and debug. This is particularly true of neural networks. In this work, we introduce automated software testing techniques for neural networks that are well-suited to discovering errors which occur only for rare inputs. Specifically, we develop coverage-guided fuzzing (CGF) methods for neural networks. In CGF, random mutations of inputs to a neural network are guided by a coverage metric toward the goal of satisfying user-specified constraints. We describe how fast approximate nearest neighbor algorithms can provide this coverage metric. We then discuss the application of CGF to the following goals: finding numerical errors in trained neural networks, generating disagreements between neural networks and quantized versions of those networks, and surfacing undesirable behavior in character level language models. Finally, we release an open source library called TensorFuzz that implements the described techniques.
