Deep Learning for MIR Tutorial	Deep Learning has become state of the art in visual computing and continuously emerges into the Music Information Retrieval (MIR) and audio retrieval domain. In order to bring attention to this topic we propose an introductory tutorial on deep learning for MIR. Besides a general introduction to neural networks, the proposed tutorial covers a wide range of MIR relevant deep learning approaches. \textbf{Convolutional Neural Networks} are currently a de-facto standard for deep learning based audio retrieval. \textbf{Recurrent Neural Networks} have proven to be effective in onset detection tasks such as beat or audio-event detection. \textbf{Siamese Networks} have been shown effective in learning audio representations and distance functions specific for music similarity retrieval. We will incorporate both academic and industrial points of view into the tutorial. Accompanying the tutorial, we will create a Github repository for the content presented at the tutorial as well as references to state of the art work and literature for further reading. This repository will remain public after the conference.
STDP Learning of Image Patches with Convolutional Spiking Neural   Networks	Spiking neural networks are motivated from principles of neural systems and may possess unexplored advantages in the context of machine learning. A class of \textit{convolutional spiking neural networks} is introduced, trained to detect image features with an unsupervised, competitive learning mechanism. Image features can be shared within subpopulations of neurons, or each may evolve independently to capture different features in different regions of input space. We analyze the time and memory requirements of learning with and operating such networks. The MNIST dataset is used as an experimental testbed, and comparisons are made between the performance and convergence speed of a baseline spiking neural network.
Variational Integrator Networks for Physically Structured Embeddings	Learning workable representations of dynamical systems is becoming an increasingly important problem in a number of application areas. By leveraging recent work connecting deep neural networks to systems of differential equations, we propose \emph{variational integrator networks}, a class of neural network architectures designed to preserve the geometric structure of physical systems. This class of network architectures facilitates accurate long-term prediction, interpretability, and data-efficient learning, while still remaining highly flexible and capable of modeling complex behavior. We demonstrate that they can accurately learn dynamical systems from both noisy observations in phase space and from image pixels within which the unknown dynamics are embedded.
Identity Matters in Deep Learning	An emerging design principle in deep learning is that each layer of a deep artificial neural network should be able to easily express the identity transformation. This idea not only motivated various normalization techniques, such as \emph{batch normalization}, but was also key to the immense success of \emph{residual networks}.   In this work, we put the principle of \emph{identity parameterization} on a more solid theoretical footing alongside further empirical progress. We first give a strikingly simple proof that arbitrarily deep linear residual networks have no spurious local optima. The same result for linear feed-forward networks in their standard parameterization is substantially more delicate. Second, we show that residual networks with ReLu activations have universal finite-sample expressivity in the sense that the network can represent any function of its sample provided that the model has more parameters than the sample size.   Directly inspired by our theory, we experiment with a radically simple residual architecture consisting of only residual convolutional layers and ReLu activations, but no batch normalization, dropout, or max pool. Our model improves significantly on previous all-convolutional networks on the CIFAR10, CIFAR100, and ImageNet classification benchmarks.
Incremental Learning Through Deep Adaptation	Given an existing trained neural network, it is often desirable to learn new capabilities without hindering performance of those already learned. Existing approaches either learn sub-optimal solutions, require joint training, or incur a substantial increment in the number of parameters for each added domain, typically as many as the original network. We propose a method called \emph{Deep Adaptation Networks} (DAN) that constrains newly learned filters to be linear combinations of existing ones. DANs precisely preserve performance on the original domain, require a fraction (typically 13\%, dependent on network architecture) of the number of parameters compared to standard fine-tuning procedures and converge in less cycles of training to a comparable or better level of performance. When coupled with standard network quantization techniques, we further reduce the parameter cost to around 3\% of the original with negligible or no loss in accuracy. The learned architecture can be controlled to switch between various learned representations, enabling a single network to solve a task from multiple different domains. We conduct extensive experiments showing the effectiveness of our method on a range of image classification tasks and explore different aspects of its behavior.
The Curious Case of Convex Networks	In this paper, we investigate a constrained formulation of neural networks where the output is a convex function of the input. We show that the convexity constraints can be enforced on both fully connected and convolutional layers, making them applicable to most architectures. The convexity constraints include restricting the weights (for all but the first layer) to be non-negative and using a non-decreasing convex activation function. Albeit simple, these constraints have profound implications on the generalization abilities of the network. We draw three valuable insights: (a) Input Output Convex Networks (IOC-NN) self regularize and almost uproot the problem of overfitting; (b) Although heavily constrained, they come close to the performance of the base architectures; and (c) The ensemble of convex networks can match or outperform the non convex counterparts. We demonstrate the efficacy of the proposed idea using thorough experiments and ablation studies on MNIST, CIFAR10, and CIFAR100 datasets with three different neural network architectures. The code for this project is publicly available at: \url{https://github.com/sarathsp1729/Convex-Networks}.
RNNs Evolving on an Equilibrium Manifold: A Panacea for Vanishing and   Exploding Gradients?	Recurrent neural networks (RNNs) are particularly well-suited for modeling long-term dependencies in sequential data, but are notoriously hard to train because the error backpropagated in time either vanishes or explodes at an exponential rate. While a number of works attempt to mitigate this effect through gated recurrent units, well-chosen parametric constraints, and skip-connections, we develop a novel perspective that seeks to evolve the hidden state on the equilibrium manifold of an ordinary differential equation (ODE). We propose a family of novel RNNs, namely {\em Equilibriated Recurrent Neural Networks} (ERNNs) that overcome the gradient decay or explosion effect and lead to recurrent models that evolve on the equilibrium manifold. We show that equilibrium points are stable, leading to fast convergence of the discretized ODE to fixed points. Furthermore, ERNNs account for long-term dependencies, and can efficiently recall informative aspects of data from the distant past. We show that ERNNs achieve state-of-the-art accuracy on many challenging data sets with 3-10x speedups, 1.5-3x model size reduction, and with similar prediction cost relative to vanilla RNNs.
HashTran-DNN: A Framework for Enhancing Robustness of Deep Neural   Networks against Adversarial Malware Samples	Adversarial machine learning in the context of image processing and related applications has received a large amount of attention. However, adversarial machine learning, especially adversarial deep learning, in the context of malware detection has received much less attention despite its apparent importance. In this paper, we present a framework for enhancing the robustness of Deep Neural Networks (DNNs) against adversarial malware samples, dubbed Hashing Transformation Deep Neural Networks} (HashTran-DNN). The core idea is to use hash functions with a certain locality-preserving property to transform samples to enhance the robustness of DNNs in malware classification. The framework further uses a Denoising Auto-Encoder (DAE) regularizer to reconstruct the hash representations of samples, making the resulting DNN classifiers capable of attaining the locality information in the latent space. We experiment with two concrete instantiations of the HashTran-DNN framework to classify Android malware. Experimental results show that four known attacks can render standard DNNs useless in classifying Android malware, that known defenses can at most defend three of the four attacks, and that HashTran-DNN can effectively defend against all of the four attacks.
Adaptively Connected Neural Networks	This paper presents a novel adaptively connected neural network (ACNet) to improve the traditional convolutional neural networks (CNNs) {in} two aspects. First, ACNet employs a flexible way to switch global and local inference in processing the internal feature representations by adaptively determining the connection status among the feature nodes (e.g., pixels of the feature maps) \footnote{In a computer vision domain, a node refers to a pixel of a feature map{, while} in {the} graph domain, a node denotes a graph node.}. We can show that existing CNNs, the classical multilayer perceptron (MLP), and the recently proposed non-local network (NLN) \cite{nonlocalnn17} are all special cases of ACNet. Second, ACNet is also capable of handling non-Euclidean data. Extensive experimental analyses on {a variety of benchmarks (i.e.,} ImageNet-1k classification, COCO 2017 detection and segmentation, CUHK03 person re-identification, CIFAR analysis, and Cora document categorization) demonstrate that {ACNet} cannot only achieve state-of-the-art performance but also overcome the limitation of the conventional MLP and CNN \footnote{Corresponding author: Liang Lin (linliang@ieee.org)}. The code is available at \url{https://github.com/wanggrun/Adaptively-Connected-Neural-Networks}.
Distributed Learning over Unreliable Networks	Most of today's distributed machine learning systems assume {\em reliable networks}: whenever two machines exchange information (e.g., gradients or models), the network should guarantee the delivery of the message. At the same time, recent work exhibits the impressive tolerance of machine learning algorithms to errors or noise arising from relaxed communication or synchronization. In this paper, we connect these two trends, and consider the following question: {\em Can we design machine learning systems that are tolerant to network unreliability during training?} With this motivation, we focus on a theoretical problem of independent interest---given a standard distributed parameter server architecture, if every communication between the worker and the server has a non-zero probability $p$ of being dropped, does there exist an algorithm that still converges, and at what speed? The technical contribution of this paper is a novel theoretical analysis proving that distributed learning over unreliable network can achieve comparable convergence rate to centralized or distributed learning over reliable networks. Further, we prove that the influence of the packet drop rate diminishes with the growth of the number of \textcolor{black}{parameter servers}. We map this theoretical result onto a real-world scenario, training deep neural networks over an unreliable network layer, and conduct network simulation to validate the system improvement by allowing the networks to be unreliable.
Graph Neural Networks for Scalable Radio Resource Management:   Architecture Design and Theoretical Analysis	Deep learning has recently emerged as a disruptive technology to solve challenging radio resource management problems in wireless networks. However, the neural network architectures adopted by existing works suffer from poor scalability, generalization, and lack of interpretability. A long-standing approach to improve scalability and generalization is to incorporate the structures of the target task into the neural network architecture. In this paper, we propose to apply graph neural networks (GNNs) to solve large-scale radio resource management problems, supported by effective neural network architecture design and theoretical analysis. Specifically, we first demonstrate that radio resource management problems can be formulated as graph optimization problems that enjoy a universal permutation equivariance property. We then identify a class of neural networks, named \emph{message passing graph neural networks} (MPGNNs). It is demonstrated that they not only satisfy the permutation equivariance property, but also can generalize to large-scale problems while enjoying a high computational efficiency. For interpretablity and theoretical guarantees, we prove the equivalence between MPGNNs and a class of distributed optimization algorithms, which is then used to analyze the performance and generalization of MPGNN-based methods. Extensive simulations, with power control and beamforming as two examples, will demonstrate that the proposed method, trained in an unsupervised manner with unlabeled samples, matches or even outperforms classic optimization-based algorithms without domain-specific knowledge. Remarkably, the proposed method is highly scalable and can solve the beamforming problem in an interference channel with $1000$ transceiver pairs within $6$ milliseconds on a single GPU.
Evolving Unsupervised Deep Neural Networks for Learning Meaningful   Representations	Deep Learning (DL) aims at learning the \emph{meaningful representations}. A meaningful representation refers to the one that gives rise to significant performance improvement of associated Machine Learning (ML) tasks by replacing the raw data as the input. However, optimal architecture design and model parameter estimation in DL algorithms are widely considered to be intractable. Evolutionary algorithms are much preferable for complex and non-convex problems due to its inherent characteristics of gradient-free and insensitivity to local optimum. In this paper, we propose a computationally economical algorithm for evolving \emph{unsupervised deep neural networks} to efficiently learn \emph{meaningful representations}, which is very suitable in the current Big Data era where sufficient labeled data for training is often expensive to acquire. In the proposed algorithm, finding an appropriate architecture and the initialized parameter values for a ML task at hand is modeled by one computational efficient gene encoding approach, which is employed to effectively model the task with a large number of parameters. In addition, a local search strategy is incorporated to facilitate the exploitation search for further improving the performance. Furthermore, a small proportion labeled data is utilized during evolution search to guarantee the learnt representations to be meaningful. The performance of the proposed algorithm has been thoroughly investigated over classification tasks. Specifically, error classification rate on MNIST with $1.15\%$ is reached by the proposed algorithm consistently, which is a very promising result against state-of-the-art unsupervised DL algorithms.
Symmetry, Saddle Points, and Global Optimization Landscape of Nonconvex   Matrix Factorization	We propose a general theory for studying the \xl{landscape} of nonconvex \xl{optimization} with underlying symmetric structures \tz{for a class of machine learning problems (e.g., low-rank matrix factorization, phase retrieval, and deep linear neural networks)}. In specific, we characterize the locations of stationary points and the null space of Hessian matrices \xl{of the objective function} via the lens of invariant groups\removed{for associated optimization problems, including low-rank matrix factorization, phase retrieval, and deep linear neural networks}. As a major motivating example, we apply the proposed general theory to characterize the global \xl{landscape} of the \xl{nonconvex optimization in} low-rank matrix factorization problem. In particular, we illustrate how the rotational symmetry group gives rise to infinitely many nonisolated strict saddle points and equivalent global minima of the objective function. By explicitly identifying all stationary points, we divide the entire parameter space into three regions: ($\cR_1$) the region containing the neighborhoods of all strict saddle points, where the objective has negative curvatures; ($\cR_2$) the region containing neighborhoods of all global minima, where the objective enjoys strong convexity along certain directions; and ($\cR_3$) the complement of the above regions, where the gradient has sufficiently large magnitudes. We further extend our result to the matrix sensing problem. Such global landscape implies strong global convergence guarantees for popular iterative algorithms with arbitrary initial solutions.
Siamese Capsule Networks	Capsule Networks have shown encouraging results on \textit{defacto} benchmark computer vision datasets such as MNIST, CIFAR and smallNORB. Although, they are yet to be tested on tasks where (1) the entities detected inherently have more complex internal representations and (2) there are very few instances per class to learn from and (3) where point-wise classification is not suitable. Hence, this paper carries out experiments on face verification in both controlled and uncontrolled settings that together address these points. In doing so we introduce \textit{Siamese Capsule Networks}, a new variant that can be used for pairwise learning tasks. The model is trained using contrastive loss with $\ell_2$-normalized capsule encoded pose features. We find that \textit{Siamese Capsule Networks} perform well against strong baselines on both pairwise learning datasets, yielding best results in the few-shot learning setting where image pairs in the test set contain unseen subjects.
Adversarial Networks for Spatial Context-Aware Spectral Image   Reconstruction from RGB	Hyperspectral signal reconstruction aims at recovering the original spectral input that produced a certain trichromatic (RGB) response from a capturing device or observer. Given the heavily underconstrained, non-linear nature of the problem, traditional techniques leverage different statistical properties of the spectral signal in order to build informative priors from real world object reflectances for constructing such RGB to spectral signal mapping. However, most of them treat each sample independently, and thus do not benefit from the contextual information that the spatial dimensions can provide. We pose hyperspectral natural image reconstruction as an image to image mapping learning problem, and apply a conditional generative adversarial framework to help capture spatial semantics. This is the first time Convolutional Neural Networks -and, particularly, Generative Adversarial Networks- are used to solve this task. Quantitative evaluation shows a Root Mean Squared Error (RMSE) drop of 33.2% and a Relative RMSE drop of 54.0% on the ICVL natural hyperspectral image dataset.
Concise Explanations of Neural Networks using Adversarial Training	We show new connections between adversarial learning and explainability for deep neural networks (DNNs). One form of explanation of the output of a neural network model in terms of its input features, is a vector of feature-attributions. Two desirable characteristics of an attribution-based explanation are: (1) $\textit{sparseness}$: the attributions of irrelevant or weakly relevant features should be negligible, thus resulting in $\textit{concise}$ explanations in terms of the significant features, and (2) $\textit{stability}$: it should not vary significantly within a small local neighborhood of the input. Our first contribution is a theoretical exploration of how these two properties (when using attributions based on Integrated Gradients, or IG) are related to adversarial training, for a class of 1-layer networks (which includes logistic regression models for binary and multi-class classification); for these networks we show that (a) adversarial training using an $\ell_\infty$-bounded adversary produces models with sparse attribution vectors, and (b) natural model-training while encouraging stable explanations (via an extra term in the loss function), is equivalent to adversarial training. Our second contribution is an empirical verification of phenomenon (a), which we show, somewhat surprisingly, occurs $\textit{not only}$ $\textit{in 1-layer networks}$, $\textit{but also DNNs}$ $\textit{trained on }$ $\textit{standard image datasets}$, and extends beyond IG-based attributions, to those based on DeepSHAP: adversarial training with $\ell_\infty$-bounded perturbations yields significantly sparser attribution vectors, with little degradation in performance on natural test data, compared to natural training. Moreover, the sparseness of the attribution vectors is significantly better than that achievable via $\ell_1$-regularized natural training.
Boosting Resolution and Recovering Texture of micro-CT Images with Deep   Learning	Digital Rock Imaging is constrained by detector hardware, and a trade-off between the image field of view (FOV) and the image resolution must be made. This can be compensated for with super resolution (SR) techniques that take a wide FOV, low resolution (LR) image, and super resolve a high resolution (HR), high FOV image. The Enhanced Deep Super Resolution Generative Adversarial Network (EDSRGAN) is trained on the Deep Learning Digital Rock Super Resolution Dataset, a diverse compilation 12000 of raw and processed uCT images. The network shows comparable performance of 50% to 70% reduction in relative error over bicubic interpolation. GAN performance in recovering texture shows superior visual similarity compared to SRCNN and other methods. Difference maps indicate that the SRCNN section of the SRGAN network recovers large scale edge (grain boundaries) features while the GAN network regenerates perceptually indistinguishable high frequency texture. Network performance is generalised with augmentation, showing high adaptability to noise and blur. HR images are fed into the network, generating HR-SR images to extrapolate network performance to sub-resolution features present in the HR images themselves. Results show that under-resolution features such as dissolved minerals and thin fractures are regenerated despite the network operating outside of trained specifications. Comparison with Scanning Electron Microscope images shows details are consistent with the underlying geometry of the sample. Recovery of textures benefits the characterisation of digital rocks with a high proportion of under-resolution micro-porous features, such as carbonate and coal samples. Images that are normally constrained by the mineralogy of the rock (coal), by fast transient imaging (waterflooding), or by the energy of the source (microporosity), can be super resolved accurately for further analysis downstream.
Multiresolution Transformer Networks: Recurrence is Not Essential for   Modeling Hierarchical Structure	The architecture of Transformer is based entirely on self-attention, and has been shown to outperform models that employ recurrence on sequence transduction tasks such as machine translation. The superior performance of Transformer has been attributed to propagating signals over shorter distances, between positions in the input and the output, compared to the recurrent architectures. We establish connections between the dynamics in Transformer and recurrent networks to argue that several factors including gradient flow along an ensemble of multiple weakly dependent paths play a paramount role in the success of Transformer. We then leverage the dynamics to introduce {\em Multiresolution Transformer Networks} as the first architecture that exploits hierarchical structure in data via self-attention. Our models significantly outperform state-of-the-art recurrent and hierarchical recurrent models on two real-world datasets for query suggestion, namely, \aol and \amazon. In particular, on AOL data, our model registers at least 20\% improvement on each precision score, and over 25\% improvement on the BLEU score with respect to the best performing recurrent model. We thus provide strong evidence that recurrence is not essential for modeling hierarchical structure.
