Learning Universal Graph Neural Network Embeddings With Aid Of Transfer   Learning	Learning powerful data embeddings has become a center piece in machine learning, especially in natural language processing and computer vision domains. The crux of these embeddings is that they are pretrained on huge corpus of data in a unsupervised fashion, sometimes aided with transfer learning. However currently in the graph learning domain, embeddings learned through existing graph neural networks (GNNs) are task dependent and thus cannot be shared across different datasets. In this paper, we present a first powerful and theoretically guaranteed graph neural network that is designed to learn task-independent graph embeddings, thereafter referred to as deep universal graph embedding (DUGNN). Our DUGNN model incorporates a novel graph neural network (as a universal graph encoder) and leverages rich Graph Kernels (as a multi-task graph decoder) for both unsupervised learning and (task-specific) adaptive supervised learning. By learning task-independent graph embeddings across diverse datasets, DUGNN also reaps the benefits of transfer learning. Through extensive experiments and ablation studies, we show that the proposed DUGNN model consistently outperforms both the existing state-of-art GNN models and Graph Kernels by an increased accuracy of 3% - 8% on graph classification benchmark datasets.
Neural SDE: Stabilizing Neural ODE Networks with Stochastic Noise	Neural Ordinary Differential Equation (Neural ODE) has been proposed as a continuous approximation to the ResNet architecture. Some commonly used regularization mechanisms in discrete neural networks (e.g. dropout, Gaussian noise) are missing in current Neural ODE networks. In this paper, we propose a new continuous neural network framework called Neural Stochastic Differential Equation (Neural SDE) network, which naturally incorporates various commonly used regularization mechanisms based on random noise injection. Our framework can model various types of noise injection frequently used in discrete networks for regularization purpose, such as dropout and additive/multiplicative noise in each block. We provide theoretical analysis explaining the improved robustness of Neural SDE models against input perturbations/adversarial attacks. Furthermore, we demonstrate that the Neural SDE network can achieve better generalization than the Neural ODE and is more resistant to adversarial and non-adversarial input perturbations.
Graph Structure of Neural Networks	"Neural networks are often represented as graphs of connections between neurons. However, despite their wide use, there is currently little understanding of the relationship between the graph structure of the neural network and its predictive performance. Here we systematically investigate how does the graph structure of neural networks affect their predictive performance. To this end, we develop a novel graph-based representation of neural networks called relational graph, where layers of neural network computation correspond to rounds of message exchange along the graph structure. Using this representation we show that: (1) a ""sweet spot"" of relational graphs leads to neural networks with significantly improved predictive performance; (2) neural network's performance is approximately a smooth function of the clustering coefficient and average path length of its relational graph; (3) our findings are consistent across many different tasks and datasets; (4) the sweet spot can be identified efficiently; (5) top-performing neural networks have graph structure surprisingly similar to those of real biological neural networks. Our work opens new directions for the design of neural architectures and the understanding on neural networks in general."
Revisiting Multiple Instance Neural Networks	Recently neural networks and multiple instance learning are both attractive topics in Artificial Intelligence related research fields. Deep neural networks have achieved great success in supervised learning problems, and multiple instance learning as a typical weakly-supervised learning method is effective for many applications in computer vision, biometrics, nature language processing, etc. In this paper, we revisit the problem of solving multiple instance learning problems using neural networks. Neural networks are appealing for solving multiple instance learning problem. The multiple instance neural networks perform multiple instance learning in an end-to-end way, which take a bag with various number of instances as input and directly output bag label. All of the parameters in a multiple instance network are able to be optimized via back-propagation. We propose a new multiple instance neural network to learn bag representations, which is different from the existing multiple instance neural networks that focus on estimating instance label. In addition, recent tricks developed in deep learning have been studied in multiple instance networks, we find deep supervision is effective for boosting bag classification accuracy. In the experiments, the proposed multiple instance networks achieve state-of-the-art or competitive performance on several MIL benchmarks. Moreover, it is extremely fast for both testing and training, e.g., it takes only 0.0003 second to predict a bag and a few seconds to train on a MIL datasets on a moderate CPU.
An FPGA-Based On-Device Reinforcement Learning Approach using Online   Sequential Learning	DQN (Deep Q-Network) is a method to perform Q-learning for reinforcement learning using deep neural networks. DQNs require large buffers for experience reply and rely on backpropagation based iterative optimization, making them difficult to be implemented on resource-limited edge devices. In this paper, we propose a lightweight on-device reinforcement learning approach for low-cost FPGA devices. It exploits a recently proposed neural-network based on-device learning approach that does not rely on the backpropagation method but uses ELM (Extreme Learning Machine) and OS-ELM (Online Sequential ELM) based training algorithms. In addition, we propose a combination of L2 regularization and spectral normalization for the on-device reinforcement learning, so that output values of the neural networks can be fit into a certain range and the reinforcement learning becomes stable. The proposed reinforcement learning approach is designed for Xilinx PYNQ-Z1 board as a low-cost FPGA platform. The experiment results using OpenAI Gym demonstrate that the proposed algorithm and its FPGA implementation complete a CartPole-v0 task 29.76x and 126.06x faster than a conventional DQN-based approach when the number of hidden-layer nodes is 64.
Neural Network based Explicit Mixture Models and   Expectation-maximization based Learning	We propose two neural network based mixture models in this article. The proposed mixture models are explicit in nature. The explicit models have analytical forms with the advantages of computing likelihood and efficiency of generating samples. Computation of likelihood is an important aspect of our models. Expectation-maximization based algorithms are developed for learning parameters of the proposed models. We provide sufficient conditions to realize the expectation-maximization based learning. The main requirements are invertibility of neural networks that are used as generators and Jacobian computation of functional form of the neural networks. The requirements are practically realized using a flow-based neural network. In our first mixture model, we use multiple flow-based neural networks as generators. Naturally the model is complex. A single latent variable is used as the common input to all the neural networks. The second mixture model uses a single flow-based neural network as a generator to reduce complexity. The single generator has a latent variable input that follows a Gaussian mixture distribution. We demonstrate efficiency of proposed mixture models through extensive experiments for generating samples and maximum likelihood based classification.
A Selective Overview of Deep Learning	Deep learning has arguably achieved tremendous success in recent years. In simple words, deep learning uses the composition of many nonlinear functions to model the complex dependency between input features and labels. While neural networks have a long history, recent advances have greatly improved their performance in computer vision, natural language processing, etc. From the statistical and scientific perspective, it is natural to ask: What is deep learning? What are the new characteristics of deep learning, compared with classical methods? What are the theoretical foundations of deep learning? To answer these questions, we introduce common neural network models (e.g., convolutional neural nets, recurrent neural nets, generative adversarial nets) and training techniques (e.g., stochastic gradient descent, dropout, batch normalization) from a statistical point of view. Along the way, we highlight new characteristics of deep learning (including depth and over-parametrization) and explain their practical and theoretical benefits. We also sample recent results on theories of deep learning, many of which are only suggestive. While a complete understanding of deep learning remains elusive, we hope that our perspectives and discussions serve as a stimulus for new statistical research.
Robustifying Sequential Neural Processes	When tasks change over time, meta-transfer learning seeks to improve the efficiency of learning a new task via both meta-learning and transfer-learning. While the standard attention has been effective in a variety of settings, we question its effectiveness in improving meta-transfer learning since the tasks being learned are dynamic and the amount of context can be substantially smaller. In this paper, using a recently proposed meta-transfer learning model, Sequential Neural Processes (SNP), we first empirically show that it suffers from a similar underfitting problem observed in the functions inferred by Neural Processes. However, we further demonstrate that unlike the meta-learning setting, the standard attention mechanisms are not effective in meta-transfer setting. To resolve, we propose a new attention mechanism, Recurrent Memory Reconstruction (RMR), and demonstrate that providing an imaginary context that is recurrently updated and reconstructed with interaction is crucial in achieving effective attention for meta-transfer learning. Furthermore, incorporating RMR into SNP, we propose Attentive Sequential Neural Processes-RMR (ASNP-RMR) and demonstrate in various tasks that ASNP-RMR significantly outperforms the baselines.
How to Train Your Deep Neural Network with Dictionary Learning	Currently there are two predominant ways to train deep neural networks. The first one uses restricted Boltzmann machine (RBM) and the second one autoencoders. RBMs are stacked in layers to form deep belief network (DBN); the final representation layer is attached to the target to complete the deep neural network. Autoencoders are nested one inside the other to form stacked autoencoders; once the stcaked autoencoder is learnt the decoder portion is detached and the target attached to the deepest layer of the encoder to form the deep neural network. This work proposes a new approach to train deep neural networks using dictionary learning as the basic building block; the idea is to use the features from the shallower layer as inputs for training the next deeper layer. One can use any type of dictionary learning (unsupervised, supervised, discriminative etc.) as basic units till the pre-final layer. In the final layer one needs to use the label consistent dictionary learning formulation for classification. We compare our proposed framework with existing state-of-the-art deep learning techniques on benchmark problems; we are always within the top 10 results. In actual problems of age and gender classification, we are better than the best known techniques.
Preventing Information Leakage with Neural Architecture Search	Powered by machine learning services in the cloud, numerous learning-driven mobile applications are gaining popularity in the market. As deep learning tasks are mostly computation-intensive, it has become a trend to process raw data on devices and send the neural network features to the cloud, whereas the part of the neural network residing in the cloud completes the task to return final results. However, there is always the potential for unexpected leakage with the release of features, with which an adversary could infer a significant amount of information about the original data. To address this problem, we propose a privacy-preserving deep learning framework on top of the mobile cloud infrastructure: the trained deep neural network is tailored to prevent information leakage through features while maintaining highly accurate results. In essence, we learn the strategy to prevent leakage by modifying the trained deep neural network against a generic opponent, who infers unintended information from released features and auxiliary data, while preserving the accuracy of the model as much as possible.
HOUDINI: Lifelong Learning as Program Synthesis	We present a neurosymbolic framework for the lifelong learning of algorithmic tasks that mix perception and procedural reasoning. Reusing high-level concepts across domains and learning complex procedures are key challenges in lifelong learning. We show that a program synthesis approach that combines gradient descent with combinatorial search over programs can be a more effective response to these challenges than purely neural methods. Our framework, called HOUDINI, represents neural networks as strongly typed, differentiable functional programs that use symbolic higher-order combinators to compose a library of neural functions. Our learning algorithm consists of: (1) a symbolic program synthesizer that performs a type-directed search over parameterized programs, and decides on the library functions to reuse, and the architectures to combine them, while learning a sequence of tasks; and (2) a neural module that trains these programs using stochastic gradient descent. We evaluate HOUDINI on three benchmarks that combine perception with the algorithmic tasks of counting, summing, and shortest-path computation. Our experiments show that HOUDINI transfers high-level concepts more effectively than traditional transfer learning and progressive neural networks, and that the typed representation of networks significantly accelerates the search.
Graph Neural Distance Metric Learning with Graph-Bert	Graph distance metric learning serves as the foundation for many graph learning problems, e.g., graph clustering, graph classification and graph matching. Existing research works on graph distance metric (or graph kernels) learning fail to maintain the basic properties of such metrics, e.g., non-negative, identity of indiscernibles, symmetry and triangle inequality, respectively. In this paper, we will introduce a new graph neural network based distance metric learning approaches, namely GB-DISTANCE (GRAPH-BERT based Neural Distance). Solely based on the attention mechanism, GB-DISTANCE can learn graph instance representations effectively based on a pre-trained GRAPH-BERT model. Different from the existing supervised/unsupervised metrics, GB-DISTANCE can be learned effectively in a semi-supervised manner. In addition, GB-DISTANCE can also maintain the distance metric basic properties mentioned above. Extensive experiments have been done on several benchmark graph datasets, and the results demonstrate that GB-DISTANCE can out-perform the existing baseline methods, especially the recent graph neural network model based graph metrics, with a significant gap in computing the graph distance.
Equivalence in Deep Neural Networks via Conjugate Matrix Ensembles	A numerical approach is developed for detecting the equivalence of deep learning architectures. The method is based on generating Mixed Matrix Ensembles (MMEs) out of deep neural network weight matrices and {\it conjugate circular ensemble} matching the neural architecture topology. Following this, the empirical evidence supports the {\it phenomenon} that distance between spectral densities of neural architectures and corresponding {\it conjugate circular ensemble} are vanishing with different decay rates at long positive tail part of the spectrum i.e., cumulative Circular Spectral Distance (CSD). This finding can be used in establishing equivalences among different neural architectures via analysis of fluctuations in CSD. We investigated this phenomenon for wide range of deep learning vision architectures and with circular ensembles originating from statistical quantum mechanics. Practical implications of the proposed method for artificial and natural neural architectures discussed such as possibility of using the approach in Neural Architecture Search (NAS) and classification of biological neural networks.
Scalable Training of Artificial Neural Networks with Adaptive Sparse   Connectivity inspired by Network Science	Through the success of deep learning in various domains, artificial neural networks are currently among the most used artificial intelligence methods. Taking inspiration from the network properties of biological neural networks (e.g. sparsity, scale-freeness), we argue that (contrary to general practice) artificial neural networks, too, should not have fully-connected layers. Here we propose sparse evolutionary training of artificial neural networks, an algorithm which evolves an initial sparse topology (Erd\H{o}s-R\'enyi random graph) of two consecutive layers of neurons into a scale-free topology, during learning. Our method replaces artificial neural networks fully-connected layers with sparse ones before training, reducing quadratically the number of parameters, with no decrease in accuracy. We demonstrate our claims on restricted Boltzmann machines, multi-layer perceptrons, and convolutional neural networks for unsupervised and supervised learning on 15 datasets. Our approach has the potential to enable artificial neural networks to scale up beyond what is currently possible.
NatCSNN: A Convolutional Spiking Neural Network for recognition of   objects extracted from natural images	Biological image processing is performed by complex neural networks composed of thousands of neurons interconnected via thousands of synapses, some of which are excitatory and others inhibitory. Spiking neural models are distinguished from classical neurons by being biological plausible and exhibiting the same dynamics as those observed in biological neurons. This paper proposes a Natural Convolutional Neural Network (NatCSNN) which is a 3-layer bio-inspired Convolutional Spiking Neural Network (CSNN), for classifying objects extracted from natural images. A two-stage training algorithm is proposed using unsupervised Spike Timing Dependent Plasticity (STDP) learning (phase 1) and ReSuMe supervised learning (phase 2). The NatCSNN was trained and tested on the CIFAR-10 dataset and achieved an average testing accuracy of 84.7% which is an improvement over the 2-layer neural networks previously applied to this dataset.
Deep Multiple Kernel Learning	Deep learning methods have predominantly been applied to large artificial neural networks. Despite their state-of-the-art performance, these large networks typically do not generalize well to datasets with limited sample sizes. In this paper, we take a different approach by learning multiple layers of kernels. We combine kernels at each layer and then optimize over an estimate of the support vector machine leave-one-out error rather than the dual objective function. Our experiments on a variety of datasets show that each layer successively increases performance with only a few base kernels.
Learning to Reason With Adaptive Computation	Multi-hop inference is necessary for machine learning systems to successfully solve tasks such as Recognising Textual Entailment and Machine Reading. In this work, we demonstrate the effectiveness of adaptive computation for learning the number of inference steps required for examples of different complexity and that learning the correct number of inference steps is difficult. We introduce the first model involving Adaptive Computation Time which provides a small performance benefit on top of a similar model without an adaptive component as well as enabling considerable insight into the reasoning process of the model.
Counterfactual Learning for Machine Translation: Degeneracies and   Solutions	Counterfactual learning is a natural scenario to improve web-based machine translation services by offline learning from feedback logged during user interactions. In order to avoid the risk of showing inferior translations to users, in such scenarios mostly exploration-free deterministic logging policies are in place. We analyze possible degeneracies of inverse and reweighted propensity scoring estimators, in stochastic and deterministic settings, and relate them to recently proposed techniques for counterfactual learning under deterministic logging.
Machine Learning For Distributed Acoustic Sensors, Classic versus Image   and Deep Neural Networks Approach	Distributed Acoustic Sensing (DAS) using fiber optic cables is a promising new technology for pipeline monitoring and protection. In this work, we applied and compared two approaches for event detection using DAS: Classic machine learning approach and the approach based on image processing and deep learning. Although with both approaches acceptable performance can be achieved, the preliminary results show that image based deep learning is more promising approach, offering six times lower event detection delay and twelve times lower execution time.
Over Parameterized Two-level Neural Networks Can Learn Near Optimal   Feature Representations	Recently, over-parameterized neural networks have been extensively analyzed in the literature. However, the previous studies cannot satisfactorily explain why fully trained neural networks are successful in practice. In this paper, we present a new theoretical framework for analyzing over-parameterized neural networks which we call neural feature repopulation. Our analysis can satisfactorily explain the empirical success of two level neural networks that are trained by standard learning algorithms. Our key theoretical result is that in the limit of infinite number of hidden neurons, over-parameterized two-level neural networks trained via the standard (noisy) gradient descent learns a well-defined feature distribution (population), and the limiting feature distribution is nearly optimal for the underlying learning task under certain conditions. Empirical studies confirm that predictions of our theory are consistent with the results observed in real practice.
Towards Understanding the Spectral Bias of Deep Learning	An intriguing phenomenon observed during training neural networks is the spectral bias, which states that neural networks are biased towards learning less complex functions. The priority of learning functions with low complexity might be at the core of explaining generalization ability of neural network, and certain efforts have been made to provide theoretical explanation for spectral bias. However, there is still no satisfying theoretical result justifying the underlying mechanism of spectral bias. In this paper, we give a comprehensive and rigorous explanation for spectral bias and relate it with the neural tangent kernel function proposed in recent work. We prove that the training process of neural networks can be decomposed along different directions defined by the eigenfunctions of the neural tangent kernel, where each direction has its own convergence rate and the rate is determined by the corresponding eigenvalue. We then provide a case study when the input data is uniformly distributed over the unit sphere, and show that lower degree spherical harmonics are easier to be learned by over-parameterized neural networks.
Learning to learn with backpropagation of Hebbian plasticity	"Hebbian plasticity is a powerful principle that allows biological brains to learn from their lifetime experience. By contrast, artificial neural networks trained with backpropagation generally have fixed connection weights that do not change once training is complete. While recent methods can endow neural networks with long-term memories, Hebbian plasticity is currently not amenable to gradient descent. Here we derive analytical expressions for activity gradients in neural networks with Hebbian plastic connections. Using these expressions, we can use backpropagation to train not just the baseline weights of the connections, but also their plasticity. As a result, the networks ""learn how to learn"" in order to solve the problem at hand: the trained networks automatically perform fast learning of unpredictable environmental features during their lifetime, expanding the range of solvable problems. We test the algorithm on various on-line learning tasks, including pattern completion, one-shot learning, and reversal learning. The algorithm successfully learns how to learn the relevant associations from one-shot instruction, and fine-tunes the temporal dynamics of plasticity to allow for continual learning in response to changing environmental parameters. We conclude that backpropagation of Hebbian plasticity offers a powerful model for lifelong learning."
