Scalable Coordinated Exploration in Concurrent Reinforcement Learning	We consider a team of reinforcement learning agents that concurrently operate in a common environment, and we develop an approach to efficient coordinated exploration that is suitable for problems of practical scale. Our approach builds on seed sampling (Dimakopoulou and Van Roy, 2018) and randomized value function learning (Osband et al., 2016). We demonstrate that, for simple tabular contexts, the approach is competitive with previously proposed tabular model learning methods (Dimakopoulou and Van Roy, 2018). With a higher-dimensional problem and a neural network value function representation, the approach learns quickly with far fewer agents than alternative exploration schemes.
No Peek: A Survey of private distributed deep learning	We survey distributed deep learning models for training or inference without accessing raw data from clients. These methods aim to protect confidential patterns in data while still allowing servers to train models. The distributed deep learning methods of federated learning, split learning and large batch stochastic gradient descent are compared in addition to private and secure approaches of differential privacy, homomorphic encryption, oblivious transfer and garbled circuits in the context of neural networks. We study their benefits, limitations and trade-offs with regards to computational resources, data leakage and communication efficiency and also share our anticipated future trends.
Representation Learning for Medical Data	We propose a representation learning framework for medical diagnosis domain. It is based on heterogeneous network-based model of diagnostic data as well as modified metapath2vec algorithm for learning latent node representation. We compare the proposed algorithm with other representation learning methods in two practical case studies: symptom/disease classification and disease prediction. We observe a significant performance boost in these task resulting from learning representations of domain data in a form of heterogeneous network.
Learning to Prove Theorems by Learning to Generate Theorems	We consider the task of automated theorem proving, a key AI task. Deep learning has shown promise for training theorem provers, but there are limited human-written theorems and proofs available for supervised learning. To address this limitation, we propose to learn a neural generator that automatically synthesizes theorems and proofs for the purpose of training a theorem prover. Experiments on real-world tasks demonstrate that synthetic data from our approach improves the theorem prover and advances the state of the art of automated theorem proving in Metamath.
Hybrid Discriminative-Generative Training via Contrastive Learning	Contrastive learning and supervised learning have both seen significant progress and success. However, thus far they have largely been treated as two separate objectives, brought together only by having a shared neural network. In this paper we show that through the perspective of hybrid discriminative-generative training of energy-based models we can make a direct connection between contrastive learning and supervised learning. Beyond presenting this unified view, we show our specific choice of approximation of the energy-based loss outperforms the existing practice in terms of classification accuracy of WideResNet on CIFAR-10 and CIFAR-100. It also leads to improved performance on robustness, out-of-distribution detection, and calibration.
Learning Sparse, Distributed Representations using the Hebbian Principle	"The ""fire together, wire together"" Hebbian model is a central principle for learning in neuroscience, but surprisingly, it has found limited applicability in modern machine learning. In this paper, we take a first step towards bridging this gap, by developing flavors of competitive Hebbian learning which produce sparse, distributed neural codes using online adaptation with minimal tuning. We propose an unsupervised algorithm, termed Adaptive Hebbian Learning (AHL). We illustrate the distributed nature of the learned representations via output entropy computations for synthetic data, and demonstrate superior performance, compared to standard alternatives such as autoencoders, in training a deep convolutional net on standard image datasets."
Learning Hierarchical Features from Generative Models	Deep neural networks have been shown to be very successful at learning feature hierarchies in supervised learning tasks. Generative models, on the other hand, have benefited less from hierarchical models with multiple layers of latent variables. In this paper, we prove that hierarchical latent variable models do not take advantage of the hierarchical structure when trained with existing variational methods, and provide some limitations on the kind of features existing models can learn. Finally we propose an alternative architecture that do not suffer from these limitations. Our model is able to learn highly interpretable and disentangled hierarchical features on several natural image datasets with no task specific regularization or prior knowledge.
SaaS: Speed as a Supervisor for Semi-supervised Learning	We introduce the SaaS Algorithm for semi-supervised learning, which uses learning speed during stochastic gradient descent in a deep neural network to measure the quality of an iterative estimate of the posterior probability of unknown labels. Training speed in supervised learning correlates strongly with the percentage of correct labels, so we use it as an inference criterion for the unknown labels, without attempting to infer the model parameters at first. Despite its simplicity, SaaS achieves state-of-the-art results in semi-supervised learning benchmarks.
Gradient Descent based Optimization Algorithms for Deep Learning Models   Training	In this paper, we aim at providing an introduction to the gradient descent based optimization algorithms for learning deep neural network models. Deep learning models involving multiple nonlinear projection layers are very challenging to train. Nowadays, most of the deep learning model training still relies on the back propagation algorithm actually. In back propagation, the model variables will be updated iteratively until convergence with gradient descent based optimization algorithms. Besides the conventional vanilla gradient descent algorithm, many gradient descent variants have also been proposed in recent years to improve the learning performance, including Momentum, Adagrad, Adam, Gadam, etc., which will all be introduced in this paper respectively.
Routine Modeling with Time Series Metric Learning	Traditionally, the automatic recognition of human activities is performed with supervised learning algorithms on limited sets of specific activities. This work proposes to recognize recurrent activity patterns, called routines, instead of precisely defined activities. The modeling of routines is defined as a metric learning problem, and an architecture, called SS2S, based on sequence-to-sequence models is proposed to learn a distance between time series. This approach only relies on inertial data and is thus non intrusive and preserves privacy. Experimental results show that a clustering algorithm provided with the learned distance is able to recover daily routines.
LALR: Theoretical and Experimental validation of Lipschitz Adaptive   Learning Rate in Regression and Neural Networks	We propose a theoretical framework for an adaptive learning rate policy for the Mean Absolute Error loss function and Quantile loss function and evaluate its effectiveness for regression tasks. The framework is based on the theory of Lipschitz continuity, specifically utilizing the relationship between learning rate and Lipschitz constant of the loss function. Based on experimentation, we have found that the adaptive learning rate policy enables up to 20x faster convergence compared to a constant learning rate policy.
Complex Skill Acquisition through Simple Skill Adversarial Imitation   Learning	Humans are able to think of complex tasks as combinations of simpler subtasks in order to learn the complex tasks more efficiently. For example, a backflip could be considered a combination of four subskills: jumping, tucking knees, rolling backwards, and thrusting arms downwards. Motivated by this line of reasoning, we propose a new algorithm that trains neural network policies on simple, easy-to-learn skills in order to cultivate latent spaces that accelerate adversarial imitation learning of complex, hard-to-learn skills. We evaluate our algorithm on a difficult task in a high-dimensional environment and see that it consistently outperforms a state-of-the-art baseline in training speed and overall task performance.
Minimax Estimation of Neural Net Distance	An important class of distance metrics proposed for training generative adversarial networks (GANs) is the integral probability metric (IPM), in which the neural net distance captures the practical GAN training via two neural networks. This paper investigates the minimax estimation problem of the neural net distance based on samples drawn from the distributions. We develop the first known minimax lower bound on the estimation error of the neural net distance, and an upper bound tighter than an existing bound on the estimator error for the empirical neural net distance. Our lower and upper bounds match not only in the order of the sample size but also in terms of the norm of the parameter matrices of neural networks, which justifies the empirical neural net distance as a good approximation of the true neural net distance for training GANs in practice.
Neural Tangents: Fast and Easy Infinite Neural Networks in Python	Neural Tangents is a library designed to enable research into infinite-width neural networks. It provides a high-level API for specifying complex and hierarchical neural network architectures. These networks can then be trained and evaluated either at finite-width as usual or in their infinite-width limit. Infinite-width networks can be trained analytically using exact Bayesian inference or using gradient descent via the Neural Tangent Kernel. Additionally, Neural Tangents provides tools to study gradient descent training dynamics of wide but finite networks in either function space or weight space.   The entire library runs out-of-the-box on CPU, GPU, or TPU. All computations can be automatically distributed over multiple accelerators with near-linear scaling in the number of devices. Neural Tangents is available at www.github.com/google/neural-tangents. We also provide an accompanying interactive Colab notebook.
Deep Learning using Linear Support Vector Machines	"Recently, fully-connected and convolutional neural networks have been trained to achieve state-of-the-art performance on a wide variety of tasks such as speech recognition, image classification, natural language processing, and bioinformatics. For classification tasks, most of these ""deep learning"" models employ the softmax activation function for prediction and minimize cross-entropy loss. In this paper, we demonstrate a small but consistent advantage of replacing the softmax layer with a linear support vector machine. Learning minimizes a margin-based loss instead of the cross-entropy loss. While there have been various combinations of neural nets and SVMs in prior art, our results using L2-SVMs show that by simply replacing softmax with linear SVMs gives significant gains on popular deep learning datasets MNIST, CIFAR-10, and the ICML 2013 Representation Learning Workshop's face expression recognition challenge."
Latent Intention Dialogue Models	Developing a dialogue agent that is capable of making autonomous decisions and communicating by natural language is one of the long-term goals of machine learning research. Traditional approaches either rely on hand-crafting a small state-action set for applying reinforcement learning that is not scalable or constructing deterministic models for learning dialogue sentences that fail to capture natural conversational variability. In this paper, we propose a Latent Intention Dialogue Model (LIDM) that employs a discrete latent variable to learn underlying dialogue intentions in the framework of neural variational inference. In a goal-oriented dialogue scenario, these latent intentions can be interpreted as actions guiding the generation of machine responses, which can be further refined autonomously by reinforcement learning. The experimental evaluation of LIDM shows that the model out-performs published benchmarks for both corpus-based and human evaluation, demonstrating the effectiveness of discrete latent variable models for learning goal-oriented dialogues.
Applying Deep Learning to Basketball Trajectories	One of the emerging trends for sports analytics is the growing use of player and ball tracking data. A parallel development is deep learning predictive approaches that use vast quantities of data with less reliance on feature engineering. This paper applies recurrent neural networks in the form of sequence modeling to predict whether a three-point shot is successful. The models are capable of learning the trajectory of a basketball without any knowledge of physics. For comparison, a baseline static machine learning model with a full set of features, such as angle and velocity, in addition to the positional data is also tested. Using a dataset of over 20,000 three pointers from NBA SportVu data, the models based simply on sequential positional data outperform a static feature rich machine learning model in predicting whether a three-point shot is successful. This suggests deep learning models may offer an improvement to traditional feature based machine learning methods for tracking data.
A Privacy-Preserving Distributed Architecture for   Deep-Learning-as-a-Service	Deep-learning-as-a-service is a novel and promising computing paradigm aiming at providing machine/deep learning solutions and mechanisms through Cloud-based computing infrastructures. Thanks to its ability to remotely execute and train deep learning models (that typically require high computational loads and memory occupation), such an approach guarantees high performance, scalability, and availability. Unfortunately, such an approach requires to send information to be processed (e.g., signals, images, positions, sounds, videos) to the Cloud, hence having potentially catastrophic-impacts on the privacy of users. This paper introduces a novel distributed architecture for deep-learning-as-a-service that is able to preserve the user sensitive data while providing Cloud-based machine and deep learning services. The proposed architecture, which relies on Homomorphic Encryption that is able to perform operations on encrypted data, has been tailored for Convolutional Neural Networks (CNNs) in the domain of image analysis and implemented through a client-server REST-based approach. Experimental results show the effectiveness of the proposed architecture.
Machine learning in spectral domain	Deep neural networks are usually trained in the space of the nodes, by adjusting the weights of existing links via suitable optimization protocols. We here propose a radically new approach which anchors the learning process to reciprocal space. Specifically, the training acts on the spectral domain and seeks to modify the eigenvectors and eigenvalues of transfer operators in direct space. The proposed method is ductile and can be tailored to return either linear or non linear classifiers. The performance are competitive with standard schemes, while allowing for a significant reduction of the learning parameter space. Spectral learning restricted to eigenvalues could be also employed for pre-training of the deep neural network, in conjunction with conventional machine-learning schemes. Further, it is surmised that the nested indentation of eigenvectors that defines the core idea of spectral learning could help understanding why deep networks work as well as they do.
Partitioning Large Scale Deep Belief Networks Using Dropout	Deep learning methods have shown great promise in many practical applications, ranging from speech recognition, visual object recognition, to text processing. However, most of the current deep learning methods suffer from scalability problems for large-scale applications, forcing researchers or users to focus on small-scale problems with fewer parameters.   In this paper, we consider a well-known machine learning model, deep belief networks (DBNs) that have yielded impressive classification performance on a large number of benchmark machine learning tasks. To scale up DBN, we propose an approach that can use the computing clusters in a distributed environment to train large models, while the dense matrix computations within a single machine are sped up using graphics processors (GPU). When training a DBN, each machine randomly drops out a portion of neurons in each hidden layer, for each training case, making the remaining neurons only learn to detect features that are generally helpful for producing the correct answer. Within our approach, we have developed four methods to combine outcomes from each machine to form a unified model. Our preliminary experiment on the mnst handwritten digit database demonstrates that our approach outperforms the state of the art test error rate.
Optimization Methods for Large-Scale Machine Learning	This paper provides a review and commentary on the past, present, and future of numerical optimization algorithms in the context of machine learning applications. Through case studies on text classification and the training of deep neural networks, we discuss how optimization problems arise in machine learning and what makes them challenging. A major theme of our study is that large-scale machine learning represents a distinctive setting in which the stochastic gradient (SG) method has traditionally played a central role while conventional gradient-based nonlinear optimization techniques typically falter. Based on this viewpoint, we present a comprehensive theory of a straightforward, yet versatile SG algorithm, discuss its practical behavior, and highlight opportunities for designing algorithms with improved performance. This leads to a discussion about the next generation of optimization methods for large-scale machine learning, including an investigation of two main streams of research on techniques that diminish noise in the stochastic directions and methods that make use of second-order derivative approximations.
Unmasking Clever Hans Predictors and Assessing What Machines Really   Learn	"Current learning machines have successfully solved hard application problems, reaching high accuracy and displaying seemingly ""intelligent"" behavior. Here we apply recent techniques for explaining decisions of state-of-the-art learning machines and analyze various tasks from computer vision and arcade games. This showcases a spectrum of problem-solving behaviors ranging from naive and short-sighted, to well-informed and strategic. We observe that standard performance evaluation metrics can be oblivious to distinguishing these diverse problem solving behaviors. Furthermore, we propose our semi-automated Spectral Relevance Analysis that provides a practically effective way of characterizing and validating the behavior of nonlinear learning machines. This helps to assess whether a learned model indeed delivers reliably for the problem that it was conceived for. Furthermore, our work intends to add a voice of caution to the ongoing excitement about machine intelligence and pledges to evaluate and judge some of these recent successes in a more nuanced manner."
Security and Machine Learning in the Real World	Machine learning (ML) models deployed in many safety- and business-critical systems are vulnerable to exploitation through adversarial examples. A large body of academic research has thoroughly explored the causes of these blind spots, developed sophisticated algorithms for finding them, and proposed a few promising defenses. A vast majority of these works, however, study standalone neural network models. In this work, we build on our experience evaluating the security of a machine learning software product deployed on a large scale to broaden the conversation to include a systems security view of these vulnerabilities. We describe novel challenges to implementing systems security best practices in software with ML components. In addition, we propose a list of short-term mitigation suggestions that practitioners deploying machine learning modules can use to secure their systems. Finally, we outline directions for new research into machine learning attacks and defenses that can serve to advance the state of ML systems security.
Neural Architecture Search with Bayesian Optimisation and Optimal   Transport	Bayesian Optimisation (BO) refers to a class of methods for global optimisation of a function $f$ which is only accessible via point evaluations. It is typically used in settings where $f$ is expensive to evaluate. A common use case for BO in machine learning is model selection, where it is not possible to analytically model the generalisation performance of a statistical model, and we resort to noisy and expensive training and validation procedures to choose the best model. Conventional BO methods have focused on Euclidean and categorical domains, which, in the context of model selection, only permits tuning scalar hyper-parameters of machine learning algorithms. However, with the surge of interest in deep learning, there is an increasing demand to tune neural network \emph{architectures}. In this work, we develop NASBOT, a Gaussian process based BO framework for neural architecture search. To accomplish this, we develop a distance metric in the space of neural network architectures which can be computed efficiently via an optimal transport program. This distance might be of independent interest to the deep learning community as it may find applications outside of BO. We demonstrate that NASBOT outperforms other alternatives for architecture search in several cross validation based model selection tasks on multi-layer perceptrons and convolutional neural networks.
Dynamics of Deep Neural Networks and Neural Tangent Hierarchy	The evolution of a deep neural network trained by the gradient descent can be described by its neural tangent kernel (NTK) as introduced in [20], where it was proven that in the infinite width limit the NTK converges to an explicit limiting kernel and it stays constant during training. The NTK was also implicit in some other recent papers [6,13,14]. In the overparametrization regime, a fully-trained deep neural network is indeed equivalent to the kernel regression predictor using the limiting NTK. And the gradient descent achieves zero training loss for a deep overparameterized neural network. However, it was observed in [5] that there is a performance gap between the kernel regression using the limiting NTK and the deep neural networks. This performance gap is likely to originate from the change of the NTK along training due to the finite width effect. The change of the NTK along the training is central to describe the generalization features of deep neural networks.   In the current paper, we study the dynamic of the NTK for finite width deep fully-connected neural networks. We derive an infinite hierarchy of ordinary differential equations, the neural tangent hierarchy (NTH) which captures the gradient descent dynamic of the deep neural network. Moreover, under certain conditions on the neural network width and the data set dimension, we prove that the truncated hierarchy of NTH approximates the dynamic of the NTK up to arbitrary precision. This description makes it possible to directly study the change of the NTK for deep neural networks, and sheds light on the observation that deep neural networks outperform kernel regressions using the corresponding limiting NTK.
Group Equivariant Convolutional Networks	We introduce Group equivariant Convolutional Neural Networks (G-CNNs), a natural generalization of convolutional neural networks that reduces sample complexity by exploiting symmetries. G-CNNs use G-convolutions, a new type of layer that enjoys a substantially higher degree of weight sharing than regular convolution layers. G-convolutions increase the expressive capacity of the network without increasing the number of parameters. Group convolution layers are easy to use and can be implemented with negligible computational overhead for discrete groups generated by translations, reflections and rotations. G-CNNs achieve state of the art results on CIFAR10 and rotated MNIST.
Investigating the influence of noise and distractors on the   interpretation of neural networks	Understanding neural networks is becoming increasingly important. Over the last few years different types of visualisation and explanation methods have been proposed. However, none of them explicitly considered the behaviour in the presence of noise and distracting elements. In this work, we will show how noise and distracting dimensions can influence the result of an explanation model. This gives a new theoretical insights to aid selection of the most appropriate explanation model within the deep-Taylor decomposition framework.
Machine Learning for Dental Image Analysis	In order to study the application of artificial intelligence (AI) to dental imaging, we applied AI technology to classify a set of panoramic radiographs using (a) a convolutional neural network (CNN) which is a form of an artificial neural network (ANN), (b) representative image cognition algorithms that implement scale-invariant feature transform (SIFT), and (c) histogram of oriented gradients (HOG).
